=== Comparing Drug Dosing Regimens ===
Configuration: P_gamma = 0.05, Duration = 120 days, N_p = 50

Running Case 1: tau_cycle=1d, tau_decay=600min
Hybrid Simulator Configuration:
  N_1 (diffusion substeps per coupling): 10
  N_p (coupling steps per day): 50
  N_a (CA substeps per coupling): 5
  N_0 (total proliferative cells to divide/day): 250
  Diffusion time step: 172.8 seconds (2.9 minutes)
  Coupling time step: 1728.0 seconds (28.8 minutes)

=== Starting CORRECTED Hybrid Simulation ===
Configuration:
  - Drug effectiveness P_gamma = 0.05
  - Simulation duration = 120 days
  - Total diffusion steps per day: 500
  - Total CA steps per day: 250
  - Initial proliferative radius: 12.31 mm
  - Initial invasive cells: 17
Day   0: Radius = 13.02 mm, Divisions =   1, Invasive =  17, Prolif =  17, Drug(avg/max) = 0.0057/0.0968
Day  20: Radius = 21.18 mm, Divisions =   5, Invasive =  17, Prolif =  57, Drug(avg/max) = 0.0158/0.1548
Day  40: Radius = 28.56 mm, Divisions =   5, Invasive =  17, Prolif =  60, Drug(avg/max) = 0.0158/0.1542
Day  60: Radius = 34.25 mm, Divisions =   9, Invasive =  18, Prolif = 101, Drug(avg/max) = 0.0157/0.1542
Day  80: Radius = 41.33 mm, Divisions =  12, Invasive =  19, Prolif = 131, Drug(avg/max) = 0.0137/0.1436
Day 100: Radius = 49.65 mm, Divisions =  15, Invasive =  20, Prolif = 155, Drug(avg/max) = 0.0091/0.1315
Day 119: Radius = 52.33 mm, Divisions =  13, Invasive =  20, Prolif = 139, Drug(avg/max) = 0.0021/0.1170

=== Simulation Complete ===
Final proliferative radius: 52.33 mm
Final Invasive radius: 44.28 mm
Final number of invasive cells: 20
Final number of proliferative cells: 139
Total tumor cells: 159
  Final radius: 52.33 mm
  Final invasive cells: 20
  Final proliferative cells: 139
  Final degraded ECM: 0

Running Case 2: tau_cycle=2d, tau_decay=1d
Hybrid Simulator Configuration:
  N_1 (diffusion substeps per coupling): 10
  N_p (coupling steps per day): 50
  N_a (CA substeps per coupling): 5
  N_0 (total proliferative cells to divide/day): 250
  Diffusion time step: 172.8 seconds (2.9 minutes)
  Coupling time step: 1728.0 seconds (28.8 minutes)

=== Starting CORRECTED Hybrid Simulation ===
Configuration:
  - Drug effectiveness P_gamma = 0.05
  - Simulation duration = 120 days
  - Total diffusion steps per day: 500
  - Total CA steps per day: 250
  - Initial proliferative radius: 12.31 mm
  - Initial invasive cells: 17
Day   0: Radius = 13.02 mm, Divisions =   1, Invasive =  17, Prolif =  17, Drug(avg/max) = 0.0458/0.4310
Day  20: Radius = 21.18 mm, Divisions =   5, Invasive =  17, Prolif =  57, Drug(avg/max) = 0.0564/0.4316
Day  40: Radius = 28.56 mm, Divisions =   5, Invasive =  17, Prolif =  60, Drug(avg/max) = 0.0563/0.4316
Day  60: Radius = 34.25 mm, Divisions =   9, Invasive =  18, Prolif = 101, Drug(avg/max) = 0.0563/0.4316
Day  80: Radius = 41.33 mm, Divisions =  12, Invasive =  19, Prolif = 131, Drug(avg/max) = 0.0533/0.4316
Day 100: Radius = 50.15 mm, Divisions =  15, Invasive =  19, Prolif = 149, Drug(avg/max) = 0.0457/0.4315
Day 119: Radius = 52.70 mm, Divisions =   8, Invasive =  19, Prolif =  87, Drug(avg/max) = 0.0024/0.1111

=== Simulation Complete ===
Final proliferative radius: 52.70 mm
Final Invasive radius: 45.08 mm
Final number of invasive cells: 19
Final number of proliferative cells: 87
Total tumor cells: 106
  Final radius: 52.70 mm
  Final invasive cells: 19
  Final proliferative cells: 87
  Final degraded ECM: 0

Running Case 3: tau_cycle=1d,tau_decay=1800min
Hybrid Simulator Configuration:
  N_1 (diffusion substeps per coupling): 10
  N_p (coupling steps per day): 50
  N_a (CA substeps per coupling): 5
  N_0 (total proliferative cells to divide/day): 250
  Diffusion time step: 172.8 seconds (2.9 minutes)
  Coupling time step: 1728.0 seconds (28.8 minutes)

=== Starting CORRECTED Hybrid Simulation ===
Configuration:
  - Drug effectiveness P_gamma = 0.05
  - Simulation duration = 120 days
  - Total diffusion steps per day: 500
  - Total CA steps per day: 250
  - Initial proliferative radius: 12.31 mm
  - Initial invasive cells: 17
Day   0: Radius = 13.02 mm, Divisions =   1, Invasive =  17, Prolif =  17, Drug(avg/max) = 0.0792/0.8761
Day  20: Radius = 21.18 mm, Divisions =   5, Invasive =  17, Prolif =  57, Drug(avg/max) = 0.1062/0.8761
Day  40: Radius = 28.56 mm, Divisions =   5, Invasive =  17, Prolif =  60, Drug(avg/max) = 0.1063/0.8761
Day  60: Radius = 34.25 mm, Divisions =   9, Invasive =  18, Prolif = 101, Drug(avg/max) = 0.1062/0.8761
Day  80: Radius = 41.33 mm, Divisions =  12, Invasive =  19, Prolif = 131, Drug(avg/max) = 0.1008/0.8761
Day 100: Radius = 49.90 mm, Divisions =  16, Invasive =  19, Prolif = 159, Drug(avg/max) = 0.0868/0.8761
Day 119: Radius = 52.32 mm, Divisions =  11, Invasive =  19, Prolif =  87, Drug(avg/max) = 0.0674/0.8761

=== Simulation Complete ===
Final proliferative radius: 52.32 mm
Final Invasive radius: 45.27 mm
Final number of invasive cells: 19
Final number of proliferative cells: 87
Total tumor cells: 106
  Final radius: 52.32 mm
  Final invasive cells: 19
  Final proliferative cells: 87
  Final degraded ECM: 0

Running Case 4: tau_cycle=1d, tau_decay=1800min, lamda_14=2.5e-5
Hybrid Simulator Configuration:
  N_1 (diffusion substeps per coupling): 10
  N_p (coupling steps per day): 50
  N_a (CA substeps per coupling): 5
  N_0 (total proliferative cells to divide/day): 250
  Diffusion time step: 172.8 seconds (2.9 minutes)
  Coupling time step: 1728.0 seconds (28.8 minutes)

=== Starting CORRECTED Hybrid Simulation ===
Configuration:
  - Drug effectiveness P_gamma = 0.05
  - Simulation duration = 120 days
  - Total diffusion steps per day: 500
  - Total CA steps per day: 250
  - Initial proliferative radius: 12.31 mm
  - Initial invasive cells: 17
Day   0: Radius = 13.02 mm, Divisions =   1, Invasive =  17, Prolif =  17, Drug(avg/max) = 0.0792/0.8761
Day  20: Radius = 21.18 mm, Divisions =   5, Invasive =  17, Prolif =  57, Drug(avg/max) = 0.1062/0.8761
Day  40: Radius = 28.56 mm, Divisions =   5, Invasive =  17, Prolif =  60, Drug(avg/max) = 0.1063/0.8761
Day  60: Radius = 34.25 mm, Divisions =   9, Invasive =  18, Prolif = 101, Drug(avg/max) = 0.1062/0.8761
Day  80: Radius = 41.33 mm, Divisions =  12, Invasive =  19, Prolif = 131, Drug(avg/max) = 0.1018/0.8761
Day 100: Radius = 49.12 mm, Divisions =  14, Invasive =  19, Prolif = 149, Drug(avg/max) = 0.0882/0.8761
Day 119: Radius = 52.35 mm, Divisions =   9, Invasive =  20, Prolif =  88, Drug(avg/max) = 0.0704/0.8761

=== Simulation Complete ===
Final proliferative radius: 52.35 mm
Final Invasive radius: 47.88 mm
Final number of invasive cells: 20
Final number of proliferative cells: 88
Total tumor cells: 108
  Final radius: 52.35 mm
  Final invasive cells: 20
  Final proliferative cells: 88
  Final degraded ECM: 0

=== Summary ===
Case		Final Radius (cm)	Invasive	Proliferative	Degraded ECM
----------------------------------------------------------------------
Case 1		5.23			20		139		0
Case 2		5.27			19		87		0
Case 3		5.23			19		87		0
Case 4		5.24			20		88		0
The simulation is completed
- 84.85 hours
